idJeu;Nom du jeu;Auteur;Éditeur;nb joueurs;âge min;Durée;Type;Notice;Zone plan;Zone bénévole;idZone;À animer;Reçu;Mécanismes;Thèmes;Tags;Description;Image;Logo;Vidéo
1040;Unicorns;Julien Mecchi;404 Editions;2 à 5 joueurs;10 ans;30 mn;Tout public;https://www.youtube.com/watch?v=L26biLZpXhk;Antigone-Sud 2;;192;non;oui;Cartes;Licornes;Licornes,Cartes;Dans ce jeu, vous incarnez des licornes s’offrant des cadeaux afin de se rendre heureuses mutuellement. Au cours de la partie, vous devrez distribuer des cartes Cadeau correspondant aux préférences de vos adversaires (et amis, quand même), et ainsi avancer au fur et à mesure sur la piste du bonheur. Votre but ? Accumuler un maximum d’étoiles et de combos (soit un maximum de points) et tomber sur les cases spéciales pour récupérer des pouvoirs qui vous avantageront au cours de la partie. Le joueur qui termine la partie avec le plus d’étoiles sera couronné meilleure licorne de sa génération !;https://cdn1.philibertnet.com/554302-thickbox_default/unicorns.jpg;https://cf.geekdo-images.com/Sdan0Xj7oc6F_RuNL1xGlA__itemrep/img/gAe6AHf2fpQlbJdv8dteXOuQKi0=/fit-in/246x300/filters:strip_icc()/pic6553140.jpg;https://www.youtube.com/watch?v=L26biLZpXhk
1041;Crime Bet;Eric Jumel;404 Editions;3 à 5 joueurs;14 ans;60 mn;Tout public;;Antigone-Sud 2;;192;non;oui;Bluff,Déduction,Paris;Pub, Bière, Meurtre;Pub, Bière, Meurtre,Bluff,Déduction,Paris;Dans ce jeu compétitif de déduction et de pari, les joueurs incarnent des clients du pub « The White Boar » qui ont organisé des paris un peu spéciaux. Ils vont pouvoir tout au long de la journée obtenir des informations cruciales sur les circonstances du meurtre, en soudoyant leur indic, d'autres joueurs ou encore la police. Aux heures de paris, ils doivent faire preuve de déduction et d'audace, tout en gérant savamment leur stock de jetons Bière, pour effectuer les paris les plus rentables ! ;https://www.festivaldesjeux-cannes.com/media/2023/01/ea682302-9e0c-478d-83a6-9bce85d9dac4.jpg;https://cf.geekdo-images.com/Sdan0Xj7oc6F_RuNL1xGlA__itemrep/img/gAe6AHf2fpQlbJdv8dteXOuQKi0=/fit-in/246x300/filters:strip_icc()/pic6553140.jpg;
1042;Tracks;Juan Rodriguez, Christian Rubiella;KYF Editions;1 à 6 joueurs;12 ans;30 mn;Tout public;https://www.youtube.com/watch?v=XybChS7r8sE;Esplanade-Est 2;;180;non;oui;Coopératif,Déduction,Enquête;Enquête policière sonore;Enquête policière sonore,Coopératif,Déduction,Enquête;Un jeu coopératif et sonore immersif ! Écoutez la piste enregistrée de l'affaire. Suivez votre cible à l'aide des cartes Caméra. Trouvez le bon endroit sur la carte pour résoudre l'affaire. 15 enquêtes palpitantes pour plus de 6 heures de jeu !!!;https://cf.geekdo-images.com/ZyNBXiy4RX-8iNYAor4fBA__itemrep/img/ZCcSUMbDUdQI9mk5CcvS-aq1AEQ=/fit-in/246x300/filters:strip_icc()/pic7079332.png;http://www.kyf-edition.com/logo_kyf.png;https://www.youtube.com/watch?v=XybChS7r8sE
1042;Tracks;Juan Rodriguez, Christian Rubiella;KYF Editions;1 à 6 joueurs;12 ans;30 mn;Tout public;https://www.youtube.com/watch?v=XybChS7r8sE;Antigone-Nord 1;Antigone-Nord 1b;230;oui;oui;Coopératif,Déduction,Enquête;Enquête policière sonore;Enquête policière sonore,Coopératif,Déduction,Enquête;Un jeu coopératif et sonore immersif ! Écoutez la piste enregistrée de l'affaire. Suivez votre cible à l'aide des cartes Caméra. Trouvez le bon endroit sur la carte pour résoudre l'affaire. 15 enquêtes palpitantes pour plus de 6 heures de jeu !!!;https://cf.geekdo-images.com/ZyNBXiy4RX-8iNYAor4fBA__itemrep/img/ZCcSUMbDUdQI9mk5CcvS-aq1AEQ=/fit-in/246x300/filters:strip_icc()/pic7079332.png;http://www.kyf-edition.com/logo_kyf.png;https://www.youtube.com/watch?v=XybChS7r8sE
1044;Founders;Samson F. Perret, Hugo Freyermuth;This way editions;3 à 6 joueurs;10 ans;45 mn;Initiés;https://thiswayeditions.com/fr/founders-fr/;Antigone-Sud 3;;193;non;oui;Cartes,Exploration,Gestion de ressources;Fondation, Objectifs secrets;Fondation, Objectifs secrets,Cartes,Exploration,Gestion de ressources;Au cœur d’un paysage balayé par les vents, un groupe d’explorateurs découvre une gigantesque grotte abritant un imposant Édifice illuminant les alentours… Autour de ce Foyer, les Maîtres Fondateurs posent les bases de ce qui deviendra la Cité, le siège des puissantes Guildes d’I C E, le premier jeu de l’éditeur !;https://thiswayeditions.com/wp-content/uploads/2022/07/FOUNDERS-box.png;https://thiswayeditions.com/wp-content/uploads/2021/07/cropped-ThisWayLogo-550.png;
1045;Biomos;Gricha German;Subverti;2 à 4 joueurs;8 ans;20 mn;Tout public;https://subverti.com/assets/dl/biomos/biomos-regles-ulule.pdf;Esplanade-Centre 5;;186;non;oui;Collection,Combinaison,Développement;Environnement, science-fiction;Environnement, science-fiction,Collection,Combinaison,Développement;Tu es une planète, une jeune planète avec un grand et bel objectif : héberger la vie ! Réussiras-tu à gagner le respect de tout le cosmos en développant la planète avec le plus de biodiversité ?;https://subverti.com/assets/img/games/biom/biomos-thumbnail.webp;https://subverti.com/assets/img/identity/subverti-horizontal-light.webp;https://www.youtube.com/watch?v=-u22pBicJrk
1046;Puzzlegend - Robinson;Yoann Levet;Blue Orange;1 à 2 joueurs;8 ans;30 mn;Tout public;https://blueorangegames.eu/wp-content/uploads/2023/01/Puzzlegend-Robinson-Rules-FR-scaled.jpg;Esplanade-Centre 4;;185;oui;oui;Cartes,Coopératif;Puzzle, Robinson Crusoé;Puzzle, Robinson Crusoé,Cartes,Coopératif;Revivez le temps d’un carnet la légende d’un illustre personnage. Progressez dans son histoire en résolvant une série de puzzles de plus en plus difficiles. Tentez de survivre et de vous échapper de l’île d’Espéranza. Mais attention, le chemin est parsemé d’embûches.;https://blueorangegames.eu/wp-content/uploads/2023/03/Puzzlegend-Robinson-3DBox.jpg;https://blueorangegames.eu/wp-content/uploads/thegem-logos/logo_2f8ee8a896e01b1b1f5df5ebcef34819_2x.png;
1047;Puzzlegend - Merlin;Yoann Levet;Blue Orange;1 à 2 joueurs;8 ans;30 mn;Tout public;https://blueorangegames.eu/wp-content/uploads/2023/01/Puzzlegend-Merlin-Rules-FR-scaled.jpg;Esplanade-Centre 4;;185;oui;oui;Cartes,Coopératif;Puzzle, Merlin l'Enchanteur;Puzzle, Merlin l'Enchanteur,Cartes,Coopératif;Revivez le temps d’un carnet la légende d’un illustre personnage. Progressez dans son histoire en résolvant une série de puzzles de plus en plus difficiles. Tentez de ramener le calme dans la forêt où des monstres ont décidé de semer la zizanie. Fabriquez des potions et combattez-les.;https://blueorangegames.eu/wp-content/uploads/2023/03/Puzzlegend-Merlin-3DBox.jpg;https://blueorangegames.eu/wp-content/uploads/thegem-logos/logo_2f8ee8a896e01b1b1f5df5ebcef34819_2x.png;
1048;Puzzlegend - Sherlock Holmes;Yoann Levet;Blue Orange;1 à 2 joueurs;8 ans;30 mn;Tout public;https://blueorangegames.eu/wp-content/uploads/2023/01/Puzzlegend-SherlockHolmes-Rules-FR-scaled.jpg;Esplanade-Centre 4;;185;oui;oui;Cartes,Coopératif;Puzzle, Sherlock Holmes;Puzzle, Sherlock Holmes,Cartes,Coopératif;Revivez le temps d’un carnet la légende d’un illustre personnage. Progressez dans son histoire en résolvant une série de puzzles de plus en plus difficiles. Vous êtes appelé afin de résoudre un terrible crime. Interrogez les témoins et éliminez les suspects afin de démasquer le vrai coupable !;https://blueorangegames.eu/wp-content/uploads/2023/03/Puzzlegend-Sherlock-3DBox.jpg;https://blueorangegames.eu/wp-content/uploads/thegem-logos/logo_2f8ee8a896e01b1b1f5df5ebcef34819_2x.png;
1049;Erune;Quentin Deleau;Arkada Studio;1 à 5 joueurs;14 ans;90 mn;Tout public;https://cdn.1j1ju.com/medias/2e/7a/41-erune-regle.pdf;Antigone-Sud 5;;195;non;oui;Affrontement,Avec application,Coopératif,Dungeon Crawler,Jeu de rôle,Pouvoir;Médiéval, Fantastique;Médiéval, Fantastique,Affrontement,Avec application,Coopératif,Dungeon Crawler,Jeu de rôle,Pouvoir;Entrez dans le monde d'Erune et parcourez ses donjons les plus sombres... Vivez des quêtes épiques, combattez des hordes de monstres et déjouez les plans diaboliques du maître des ombres !;https://i0.wp.com/arkada.studio/wp-content/uploads/2021/09/HEROIC_BOX_1000x1000_Spiel_21.jpg;https://i0.wp.com/arkada.studio/wp-content/uploads/2022/02/Arkada-Speak-With-Your-Game.png?w=1080&ssl=1;https://www.youtube.com/watch?v=qGYvEqb4UhU
1050;Spark Riders 3000;Arkada Studio;Arkada Studio;1 à 4 joueurs;10 ans;60 mn;Tout public;https://arkada.studio/wp-content/uploads/2022/09/FR_SPARKRIDERS_LivreRegles.pdf;Antigone-Sud 5;;195;non;oui;Avec application,Coopératif,Dés,Solo;Science Fiction;Science Fiction,Avec application,Coopératif,Dés,Solo;Incarnez l'équipage du Spark, le vaisseau spatial doté de l'IA la plus avancée de l'univers. Votre mission est de livrer de précieuses cargaisons aux quatre coins de la galaxie pour assurer la survie de l'humanité. Attention, des pirates extraterrestres et des environnements hostiles vous attendent, alors seuls les meilleurs arriveront en un seul morceau.;https://cf.geekdo-images.com/NSNgxuCvCyyxy7dTL7bpIA__itemrep/img/npnuOk2OK60V9pXaCySRA_-1pxc=/fit-in/246x300/filters:strip_icc()/pic7037102.jpg;https://i0.wp.com/arkada.studio/wp-content/uploads/2022/02/Arkada-Speak-With-Your-Game.png?w=1080&ssl=1;https://arkada.studio/page-kickstarter-francaise/
1051;Empédocle Kyklo;Alexis Suard;Poptalks;2 à 5 joueurs;10 ans;30 mn;Tout public;https://www.poptalks.com/wp-content/uploads/2023/02/empedocle_kyklo_finale_v2.pd.pdf;Antigone-Sud 5;;195;non;oui;Dés;;Dés;A la demande du Grand Architecte, chacun cherche à briser le cycle d’Empédocle pour stabiliser le Monde Terrestre du côté de l’Amour. Pour cela, les forces doivent se débarrasser de leur Haine.;https://www.poptalks.com/wp-content/uploads/2022/11/annonce_sortie_empedocle_kyklo_v3.png;https://www.poptalks.com/wp-content/uploads/2022/08/cropped-296995420_5266472316767673_1086588367184898966_n.png;https://www.poptalks.com/empedocle/
1052;Wuxing Duel;Alexis Suard;Poptalks;2 joueurs;6 ans;20 mn;Tout public;https://www.poptalks.com/wuxing-duel/;Antigone-Sud 5;;195;non;oui;Casse-tête;Chine, Duel;Chine, Duel,Casse-tête;Anticipez les mouvements de votre adversaire pour maîtriser le Wuxing. Les Wuxing sont les cinq éléments (xing) chinois (wu). Chaque élément détruit ou engendre deux éléments et est lui-même détruit ou engendré par deux autres éléments.;https://www.poptalks.com/wp-content/uploads/2023/03/tuiles_wuxing_duel_pour_site_web_v1-1024x686.png;https://www.poptalks.com/wp-content/uploads/2022/08/cropped-296995420_5266472316767673_1086588367184898966_n.png;
1054;Rainbow 7;Alexandre Emerit, Antoine Davrou;Ghost Dog Games;2 à 5 joueurs;8 ans;20 mn;Tout public;https://cdn.1j1ju.com/medias/d6/86/53-rainbow-7-regle.pdf;Antigone-Sud 4;Antigone-Sud 4d;209;oui;oui;Cartes;Crachins, averses, orages ! Mais après, il y a des arcs-en-ciel non ?;Crachins, averses, orages ! Mais après, il y a des arcs-en-ciel non ?,Cartes;Rainbow 7 est un jeu de cartes fun, rapide, malin et coloré dont on enchaîne les parties sans se rendre compte du temps qui passe.;http://ghostdoggames.com/wp-content/uploads/2022/04/RAINBOW7_BOX3D_Right-1.jpg;http://ghostdoggames.com/wp-content/uploads/2021/10/Logo_Noir_Blanc_Fond-1.png;https://youtu.be/3etD9axVids
1055;Myriades;Romaric Galonnier, Benoit Turpin;Ghost Dog Games;1 à 5 joueurs;7 ans;20 mn;Tout public;https://www.youtube.com/watch?v=Enih2mq81ko;Antigone-Sud 4;Antigone-Sud 4d;209;oui;oui;Pose de tuiles,Temps réel;Mer, Îles;Mer, Îles,Pose de tuiles,Temps réel;Le Grand Océan s'étend sur tout le monde connu, et l'archipel des Myriades se trouve au milieu de cette étendue. Vous êtes un jeune capitaine, à la tête d'une petite flotte, et vous parcourez les mers à la recherche de quelques îles hospitalières où votre peuple pourra s'installer et prospérer dans le bonheur.;https://cf.geekdo-images.com/NGDfEBSfp_uAoFimf8VvtA__itemrep/img/gEsv0me7oeUg0JmN7A2SCC6tBXs=/fit-in/246x300/filters:strip_icc()/pic7332889.jpg;http://ghostdoggames.com/wp-content/uploads/2021/10/Logo_Noir_Blanc_Fond-1.png;https://www.youtube.com/watch?v=Enih2mq81ko
1056;Boussanga;Madani Traore, Nicolas Orange;Oka Luda;1 à 4 joueurs;8 ans;30 mn;Tout public;https://cdn.1j1ju.com/medias/33/a6/78-boussanga-regle.pdf;Esplanade-Centre 2;;183;non;oui;Alignement,Damier;Abstrait, magie, nature;Abstrait, magie, nature,Alignement,Damier;Eau, Terre, Feu ou Air, c’est quand ils sont alignés que les éléments sont les plus puissants. Grâce aux cartes données par la chamane, réalisez l’alignement parfait – le « Boussanga » – et mettez les forces de la Nature de votre côté.;https://www.gigamic.com/files/catalog/products/images/product/oka-luda-boussanga-boite-3d-web.webp;https://okaluda.fr/wp-content/uploads/2018/10/cropped-logo-nicofinal-FOND-TRANSPARENT.png;https://www.youtube.com/watch?v=unFBcRZ093o
1057;Lanfeust de Troy, chapitre 1;Nathalie Saunier, Rémi Saunier;Oka Luda;2 à 4 joueurs;8 ans;20 mn;Tout public;https://okaluda.fr/lanfeust/;Esplanade-Centre 2;;183;non;oui;Dés,Exploration;Univers Lanfeust de Troy;Univers Lanfeust de Troy,Dés,Exploration;Lanfeust de Troy est un jeu d’exploration où vous incarnerez l’un des héros de la célèbre Bande-Dessinée. Un univers de magie, riche en aventures, où tous les exploits sont possibles. Combattez des monstres, explorez de sombres cavernes, pillez des trésors;https://okaluda.fr/wp-content/uploads/2023/03/lanfeust-oka-luda-boite-03b.png;https://okaluda.fr/wp-content/uploads/2018/10/cropped-logo-nicofinal-FOND-TRANSPARENT.png;
1058;Suricate;Grégory Germain, Joan Dufour;Oka Luda;2 à 4 joueurs;8 ans;20 mn;Tout public;https://okaluda.fr/suricates/;Esplanade-Centre 2;;183;non;oui;Combinaison,Coopératif;Animaux, Evasion;Animaux, Evasion,Combinaison,Coopératif;Suricates est un jeu coopératif où tous les joueurs vont devoir réaliser des combinaisons précises en déplaçant leur personnage afin de creuser un tunnel pour que leurs amis suricates puissent s’évader.;https://okaluda.fr/wp-content/uploads/2023/04/vue-boite-droite.png;https://okaluda.fr/wp-content/uploads/2018/10/cropped-logo-nicofinal-FOND-TRANSPARENT.png;
1059;Yuan;;Oka Luda;;;;Tout public;;Esplanade-Centre 2;;183;non;oui;;;;;;https://okaluda.fr/wp-content/uploads/2018/10/cropped-logo-nicofinal-FOND-TRANSPARENT.png;
1060;Fish & Cheat;Rob Piesse;Gigamic;4 à 10 joueurs;10 ans;30 mn;Ambiance;https://www.gigamic.com/files/catalog/products/rules/fish_cheat_rules_bd.pdf;Esplanade-Centre 1;;182;non;oui;Bluff,Rôles cachés;Quizz , Défis;Quizz , Défis,Bluff,Rôles cachés;Dans Fish and Cheat, les joueurs vont se succéder au rôle de celui qui pose une question sur un fait insolite drôle. Votre but est alors de découvrir la seule bonne réponse parmi les mensonges des autres joueurs. Et au tour suivant, c'est sûrement vous qui devrez inventer une réponse improbable pour embobiner le lecteur de la question!;https://www.gigamic.com/files/catalog/products/images/product/gigamic_fish-and-cheat_left_11-2022.webp;https://www.gigamic.com/images/logo.png;https://www.youtube.com/watch?v=9_4lHM5DaZE
1062;Bernard;Bakakou;Gigamic;3 à 18 joueurs;16 ans;20 mn;Ambiance;https://www.gigamic.com/files/catalog/products/rules/regles_-_bernard_-_prod_fr-001_-_ind_a_compressed.pdf;Esplanade-Centre 1;;182;non;oui;Cartes,Déduction;Devinettes, Personnages;Devinettes, Personnages,Cartes,Déduction;On pose des cartes chacun son tour et on essaie de penser à un personnage, célèbre ou non, répondant à la description qui se construit sur la table. Attention, à un moment il faudra se justifier. Si le portrait n’est pas validé, il faudra piocher. Le but : ne plus avoir de carte.;https://www.gigamic.com/files/catalog/products/images/product/gigamic_jber_3760345040013_bernard_box-left_bd.webp;https://www.gigamic.com/images/logo.png;https://www.youtube.com/watch?v=V7ThU8fu9Fc
1063;Le Poing sur la table;Olivier Mousseau;Funny Fox;3 à 8 joueurs;8 ans;15 mn;Ambiance;https://cdn.1j1ju.com/medias/78/a5/a4-le-poing-sur-la-table-regle.pdf;Esplanade-Centre 2;;183;non;oui;Cartes,Communication;Vie Quotidienne;Vie Quotidienne,Cartes,Communication;Le Poing sur la Table est un jeu dynamique et fun, où il faudra argumenter pour vous en sortir et taper du poing pour faire entendre votre voix !;https://www.gigamic.com/files/catalog/products/images/product/gigamic_fupoi_le-poing-sur-la-table_box_left_bd.webp;https://funnyfox.fr/wp-content/uploads/sites/21/2019/09/FunnyfoxNEW3-1024x715.png;https://www.youtube.com/watch?v=otGG8DFL0qc
1064;Hiroba;Johan Benvenuto, Alexandre Droit, Bertrand Roux;Funny Fox;2 à 4 joueurs;10 ans;25 mn;Ambiance;https://www.gigamic.com/files/catalog/products/rules/livret_r__gles-fr-hiroba.pdf;Esplanade-Centre 2;;183;non;oui;Logique,Majorité;Asie, Jardins;Asie, Jardins,Logique,Majorité;Dans Hiroba, placez astucieusement vos galets numérotés afin d’être majoritaires dans le plus de jardins. Reprenant le principe du Sudoku, il ne peut jamais y avoir deux galets de même valeur dans un même jardin, une même ligne ou une même colonne. Soyez fins stratèges pour contrer vos adversaires et ne négligez pas les très convoitées carpes koï qui pourront vous rapporter de précieux points. Parviendrez-vous à garder le contrôle et rester zen face à vos adversaires ?;https://www.gigamic.com/files/catalog/products/images/product/hiroba_fr_left_web.webp;https://funnyfox.fr/wp-content/uploads/sites/21/2019/09/FunnyfoxNEW3-1024x715.png;https://www.youtube.com/watch?v=X0Supd94BAs
1065;Rainforest;Johannes Goupy;Funny Fox;3 à 6 joueurs;8 ans;30 mn;Tout public;https://cdn.1j1ju.com/medias/2b/05/16-rainforest-regle.pdf;Esplanade-Centre 2;;183;non;oui;Connexions,Pose de tuiles;Préservation de la nature;Préservation de la nature,Connexions,Pose de tuiles;Dans Rainforest, agencez harmonieusement votre jungle avec les différents types de végétation et réintroduisez les espèces animales emblématiques de la région pour aider à leur préservation : singes, grenouilles, papillons ou encore perroquets. Mais n’oubliez pas d’assurer la pérennité de votre animal totem, car il pourrait vous rapporter de précieux points. Parviendrez-vous à faire de votre jungle un berceau de la diversité ?;https://www.gigamic.com/files/catalog/products/images/product/gigamic_furai_rainforest_box-left.webp;https://funnyfox.fr/wp-content/uploads/sites/21/2019/09/FunnyfoxNEW3-1024x715.png;https://www.youtube.com/watch?v=4E2NxigxrT0
1066;The Crown;Thibault Gastaud;Itanooki;3 à 8 joueurs;10 ans;15 mn;Ambiance;https://www.kickstarter.com/projects/itanooki/the-crown/?ref=kicktraq;Antigone-Sud 5;;195;non;oui;Cartes;Médiéval;Médiéval,Cartes;Pour gagner une partie de The Crown, il faut soit avoir le plus grand nombre de points soit être le seul joueur à ne pas s'être fait éliminer !;https://pbs.twimg.com/media/Fp1ZleJXoAMI9N5.jpg;https://scontent-mrs2-2.xx.fbcdn.net/v/t39.30808-6/309847241_433704705560118_8949074585674925956_n.jpg?_nc_cat=101&ccb=1-7&_nc_sid=09cbfe&_nc_ohc=Y7G1;https://www.kickstarter.com/projects/itanooki/the-crown/?ref=kicktraq
1067;Vaalbara;Olivier Cipiere;Studio H;2 à 5 joueurs;10 ans;20 mn;Tout public;https://www.gigamic.com/files/catalog/products/rules/vaalbara_rulebook-fr-1.pdf;Esplanade-Centre 2;;183;non;oui;Cartes,Collection,Gestion de main;Préhistorique;Préhistorique,Cartes,Collection,Gestion de main;Sous-continent de Vaalbara, ère néolithique. Votre tribu se lance à l’exploration de terres inconnues afin d’établir des villages sédentaires. Utilisez intelligemment les talents variés de vos membres pour optimiser votre développement, étendre votre territoire et imposer votre hégémonie !;https://www.gigamic.com/files/catalog/products/images/product/1studioh_box_vaalbara.webp;https://cf.geekdo-images.com/IALiXfLAr4S63_BiaUo5Mw__itemrep/img/23zI646WO5CpzpvaLyLHaOKo0fM=/fit-in/246x300/filters:strip_icc()/pic4972566.jpg;https://videoregles.net/videoregle/vaalbara
1068;Vivarium;Frédéric Vuagnat;Studio H;2 à 4 joueurs;10 ans;30 mn;Tout public;https://www.gigamic.com/files/catalog/products/rules/vivarium_rulebook_fr_web.pdf;Esplanade-Centre 2;;183;non;oui;Cartes,Collection,Draft;Nature, Animaux;Nature, Animaux,Cartes,Collection,Draft;1898, Sibérie, le sismologue Edgar Vuntaf découvre un continent vierge de toute présence humaine, abritant une vie foisonnante, sous des formes jamais rencontrées auparavant ! Face à cette bouleversante découverte, l’élite scientifique mondiale, réunie à Paris pour l’Exposition Universelle, fonde en hâte la première société savante internationale : « Le Vivarium ». Explorateurs, zoologistes, botanistes, cartographes… vous êtes missionnés pour recenser les fascinantes espèces de ce mystérieux continent, et remplir au mieux les requêtes de vos commanditaires. Pour la science et pour le Vivarium !;https://www.gigamic.com/files/catalog/products/images/product/gigamic_stviv_vivarium_box-left_3616450014879_bd.webp;https://cf.geekdo-images.com/IALiXfLAr4S63_BiaUo5Mw__itemrep/img/23zI646WO5CpzpvaLyLHaOKo0fM=/fit-in/246x300/filters:strip_icc()/pic4972566.jpg;https://www.youtube.com/watch?v=WTkdEt6ziJI
1069;Maître Renard;Frédéric Vuagnat;Studio H;2 à 4 joueurs;7 ans;30 mn;Enfants;https://regle.escaleajeux.fr/mrena_rg.pdf;Esplanade-Centre 2;;183;non;oui;Déduction,Mémoire;Fable;Fable,Déduction,Mémoire;Le célèbre Maître Renard se fait vieux et cherche son successeur parmi les intrépides voleurs de la forêt. C'est peut-être votre chance de prouver votre talent de voleur et de prendre sa place ! Pour impressionner le vieux renard, vous devez accomplir les missions qu'il vous confiera et lui rapporter le plus gros butin de la chaumière voisine. Mais tu n'es pas le seul jeune renard ambitieux dans le coin...;https://cdn1.philibertnet.com/429119-large_default/maitre-renard.jpg;https://cf.geekdo-images.com/IALiXfLAr4S63_BiaUo5Mw__itemrep/img/23zI646WO5CpzpvaLyLHaOKo0fM=/fit-in/246x300/filters:strip_icc()/pic4972566.jpg;https://videoregles.net/videoregle/maitre-renard
1070;AracKhan Wars; Mickaël Bour, Robert Palmer;Nothing But Games;2 à 4 joueurs;14 ans;45 mn;Initiés;https://drive.google.com/file/d/1J8cA6n4o_uFYXQf1G1UgZBdwrcHlobGK/view?usp=share_link;Antigone-Sud 2;;192;non;oui;Asymétrie,Bluff,Cartes,Draft,Gestion de main,Majorité,Paris;Fantastique;Fantastique,Asymétrie,Bluff,Cartes,Draft,Gestion de main,Majorité,Paris;AracKhan Wars est un jeu de cartes tactique où deux joueurs s'affrontent en duels épiques. Prenez le contrôle d'une province d'AracKhan et défiez votre adversaire sur le champ de bataille ! Lancez l'assaut de votre armée de 23 cartes ! Lancez des sorts ! Jouez prudemment vos cartes et déjouez les plans de votre adversaire. Vos talents de stratège seront aussi importants que la valeur de vos cartes. Il n'y aura qu'un vainqueur qui émergera du 9ème round !;https://cf.geekdo-images.com/mi3ZaJ8kIHiTdDzHuJBcew__itemrep/img/x2g_c0JDKTtohqEWItxE0SDbAb4=/fit-in/246x300/filters:strip_icc()/pic6203741.jpg;https://static.wixstatic.com/media/c79105_c2d6f6164f7240488122784a6c4b8ec9~mv2.jpg/v1/fill/w_978,h_620,al_c,q_85,enc_auto/Site%20en%20construction%20-;https://youtu.be/jlXLfP3DYpE
1071;Aïe Aïe Burrito;Elan Lee, Matthew Inman, Brian S. Spence;Exploding Kittens;2 à 6 joueurs;7 ans;30 mn;Ambiance;https://dumekj556jp75.cloudfront.net/ttb/burrito-french.pdf;Esplanade-Est 1;;179;non;oui;Adresse,Cartes;Alimentation;Alimentation,Adresse,Cartes;Le jeu d'ambiance Aïe Aïe Burrito est le premier jeu de cartes au monde de balle au prisonnier. Collectez des cartes. Jouez votre main. Lancez des objets sur vos amis.;https://cdn1.philibertnet.com/484301-large_default/throw-throw-burrito.jpg;https://th.bing.com/th?id=OIP.lmwyhwkn6Lvc9lYPo4am6AHaHa&w=250&h=250&c=8&rs=1&qlt=90&o=6&pid=3.1&rm=2;https://www.youtube.com/watch?v=8LbWXDAfg4I
1072;Aïe Aïe Avocat;Elan Lee, Matthew Inman, Brian S. Spence;Exploding Kittens;2 à 6 joueurs;7 ans;30 mn;Ambiance;;Esplanade-Est 1;;179;non;oui;Adresse,Cartes;Alimentation;Alimentation,Adresse,Cartes;Le jeu d'ambiance Aïe Aïe Avocat est un jeu de cartes de balle au prisonnier. Collectez des cartes. Jouez votre main. Lancez des objets sur vos amis.;https://cdn1.philibertnet.com/570343-large_default/aie-aie-avocat.jpg;https://th.bing.com/th?id=OIP.lmwyhwkn6Lvc9lYPo4am6AHaHa&w=250&h=250&c=8&rs=1&qlt=90&o=6&pid=3.1&rm=2;
1073;Mantis;Jeremy Posner, Ken Gruhl;Exploding Kittens;2 à 6 joueurs;7 ans;30 mn;Ambiance;https://ek-instructions.s3.amazonaws.com/mantis/Mantis_Instructions.pdf;Esplanade-Est 1;;179;non;oui;Cartes,Collection,Draft;Animaux;Animaux,Cartes,Collection,Draft;Mantis est un jeu de cartes coloré et impitoyable, simple et profond.;https://cdn2.philibertnet.com/571461-large_default/mantis.jpg;https://th.bing.com/th?id=OIP.lmwyhwkn6Lvc9lYPo4am6AHaHa&w=250&h=250&c=8&rs=1&qlt=90&o=6&pid=3.1&rm=2;
1074;Branle-Bas de Wombat;Elan Lee, Matthew Inman, Cory O'Brien;Exploding Kittens;3 à 6 joueurs;7 ans;30 mn;Ambiance;;Esplanade-Est 1;;179;non;oui;Adresse,Bluff,Cartes,Construction,Rôles cachés,Semi-coopératif,Temps réel;Animaux;Animaux,Adresse,Bluff,Cartes,Construction,Rôles cachés,Semi-coopératif,Temps réel;Branle-Bas de Wombat est un jeu de dextérité qui mêle coopération et perfidie ! Tentez de bâtir trois tours avant que les adversaires ne les détruisent !;https://cdn3.philibertnet.com/571414-thickbox_default/branle-bas-de-wombat.jpg;https://th.bing.com/th?id=OIP.lmwyhwkn6Lvc9lYPo4am6AHaHa&w=250&h=250&c=8&rs=1&qlt=90&o=6&pid=3.1&rm=2;
