idJeu;Nom du jeu;Auteur;Éditeur;nb joueurs;âge min;Durée;Type;Notice;Zone plan;Zone bénévole;idZone;À animer;Reçu;Mécanismes;Thèmes;Tags;Description;Image;Logo;Vidéo
965;Colorado;Joachim Thôme;Sylex Edition;2 à 4 joueurs;12 ans;40 mn;Tout public;https://cdn.1j1ju.com/medias/ad/ea/ae-colorado-rulebook.pdf;Antigone-Nord 1;Antigone-Nord 1a;229;oui;oui;Call and write,Cartes,Collection;Far-west;Far-west,Call and write,Cartes,Collection;Vous Explorez l'Ouest américain avec un feutre et des carte pour tout équipement. Appelez les bonnes cartes et faites les meilleurs enchainements, équipez vos personnages avec leur outil et leur moyen de transport préféré pour vous ouvrir les portes d nouvelles régions et ainsi garantir le succès de vos expéditions !;https://i0.wp.com/sylex-edition.fr/wp-content/uploads/2022/12/Colorado.png?resize=300%2C300&ssl=1;https://i0.wp.com/sylex-edition.fr/wp-content/uploads/2022/12/Sylex-Colorado.png?fit=300%2C234&ssl=1;https://www.youtube.com/watch?v=clMG33Kj1UM
966;Akropolis;Jules Messaud;Gigamic;2 à 4 joueurs;8 ans;30 mn;Tout public;https://cdn.1j1ju.com/medias/58/eb/a4-akropolis-regle.pdf;Esplanade-Centre 1;;182;non;oui;Pose de tuiles;Antiquité;Antiquité,Pose de tuiles;Akropolis est un jeu de stratégie simple avec des éléments en 3D, où vous devrez gagner du prestige en construisant les meilleures cités au cœur de l'antique Méditerranée.;https://cdn2.philibertnet.com/571750-large_default/akropolis.jpg;https://www.gigamic.com/images/logo.png;https://videoregles.net/videoregle/akropolis
967;La Colline aux Feux Follets;Bernhard Weber, Jens-Peter Schliemann;Gigamic;1 à 4 joueurs;5 ans;25 mn;Tout public;https://cdn.1j1ju.com/medias/db/61/c6-la-colline-aux-feux-follets-regle.pdf;Esplanade-Centre 1;;182;non;oui;Coopératif;Nature, Magie;Nature, Magie,Coopératif;Dans La Colline aux Feux Follets, il faudra arriver en bas de la colline avant les sorcières en vous laissant guider par les feux follets: faites glisser vos billes de façon à ce qu'elles touchent les apprentis et leur montrent le chemin.;https://cdn2.philibertnet.com/545216-large_default/la-colline-aux-feux-follets.jpg;https://www.gigamic.com/images/logo.png;https://www.youtube.com/watch?v=_JFb5brgbqg
968;Revelio;Dave Neale;Gigamic;3 à 6 joueurs;14 ans;25 mn;Tout public;https://www.gigamic.com/files/catalog/products/rules/gigamic_revelio_rules_04-2022_update_bd.pdf;Esplanade-Centre 1;;182;non;oui;Déduction,Éloquence;Médiéval Fantastique, Ere Victorienne, Ere Moderne;Médiéval Fantastique, Ere Victorienne, Ere Moderne,Déduction,Éloquence;Dans Revelio, les joueurs vont incarner un personnage d’un univers spécifique : médiéval-fantastique, époque victorienne ou contemporaine, exerçant une activité précise et gardant un secret bien particulier. A chacun des 5 tours, les joueurs répondront tous à la même question comme le ferait leur personnage, en dévoilant quelques indices sur leur personnalité, afin que les autres finissent par découvrir qui ils sont. Mais pas tous, sinon, le joueur ne marque pas de points. Et lui-même doit trouver l’identité des autres, métier et secret, pour ajouter des points qui lui permettront de remporter la victoire !;https://cdn3.philibertnet.com/566051-large_default/revelio.jpg;https://www.gigamic.com/images/logo.png;https://www.youtube.com/watch?v=T0Tm7xMjZdM
969;Qawale;Didier Lenain Bragard, Romain FROGER;Gigamic;3 joueurs;8 ans;25 mn;Tout public;https://www.gigamic.com/files/catalog/products/rules/gigamic_gcqw_qawale_rules-us-fr_web.pdf;Esplanade-Centre 1;;182;non;oui;Alignement,Connexions,Logique;Quarto;Quarto,Alignement,Connexions,Logique;Alignez vos galets ! Simple et tactique à la fois, Qawale trouve son inspiration dans les piles de galets que l'on trouve au bord des chemins. À l'image de ces pierres qui voyagent, placez un galet au sommet d'une pile avant de l'égrener sur les cases du plateau. Formez une ligne de 4 galets de votre couleur pour remporter la partie.;https://cdn3.philibertnet.com/555256-large_default/qawale.jpg;https://www.gigamic.com/images/logo.png;https://www.youtube.com/watch?v=zOo4w5rZQcY
971;Phantom Ink;Mary Flanagan, Max Seidman;Gigamic;4 à 8 joueurs;10 ans;15 mn;Ambiance;https://www.gigamic.com/files/catalog/products/rules/gigamic_phantom-ink_rules_11-2022-_compressed.pdf;Esplanade-Centre 1;;182;non;oui;Déduction;Quizz, Défis, Abstrait, Lettres et Mots;Quizz, Défis, Abstrait, Lettres et Mots,Déduction;Chacun son tour, le fantôme de l'équipe donne des indices en répondant à une question secrète: il inscrit lettre à lettre sur le Bloc d'écriture le mot avant d'être stoppé par ses médiums le plus tôt possible pour ne pas donner d'indications à l'équipe adverse. La première équipe à trouver le mot mystère remporte la partie!;https://cdn1.philibertnet.com/571573-large_default/phantom-ink.jpg;https://www.gigamic.com/images/logo.png;https://www.youtube.com/watch?v=YnFKP8JTH6E
972;Triqueta;Stefan Dorra, Ralf zur Linde;Gigamic;2 à 5 joueurs;8 ans;25 mn;Tout public;https://www.gigamic.com/files/catalog/products/rules/gigamic_triqueta_rules_10-2022_compressed.pdf;Esplanade-Centre 1;;182;non;oui;Collection,Gestion de main,Pose de tuiles;Animaux;Animaux,Collection,Gestion de main,Pose de tuiles;Collectionnez des séries de jetons d'animaux mystiques et formez des triquetas parfaites ! Dans Triqueta, le but du jeu est d'obtenir le plus de points en formant des ensembles de  3 tuiles identiques appelées 'Triqueta'. On décide donc du moment idéal pour quitter la manche en ramassant une rangée de tuiles, mais attention, certaines rangées vous feront ramasser des tuiles qui ne vous intéressent pas ou qui vous donneront des points négatifs en fin de partie... Choisissez judicieusement!;https://cdn1.philibertnet.com/571438-large_default/triqueta.jpg;https://www.gigamic.com/images/logo.png;https://www.lapouleapois.fr/jeux-de-societe/19958-jeu-triqueta-gigamic-3421272376612.html
973;Evergreen;Hjalmar Hach;Gigamic;1 à 4 joueurs;10 ans;45 mn;Tout public;https://www.gigamic.com/files/catalog/products/rules/gigamic_evergreen_rules_10-2022_update-2.pdf;Esplanade-Centre 1;;182;non;oui;Draft;Nature, Abstrait;Nature, Abstrait,Draft;Evergreen est un jeu de stratégie abstrait pour 1 à 4 joueurs par Hjalmar Hach, concepteur du jeu primé Photosynthésis, où votre objectif est de construire un écosystème luxuriant, en plantant des graines, en faisant pousser des arbres et en plaçant d'autres éléments naturels sur votre planète, en essayant d'en faire la plus verte et la plus fertile de toutes.;https://cdn2.philibertnet.com/568893-large_default/evergreen.jpg;https://www.gigamic.com/images/logo.png;https://www.youtube.com/watch?v=frVJ-S_TR4g
974;Cosy Casa;Phil Walker Hardi;Gigamic;2 à 4 joueurs;8 ans;30 mn;Tout public;https://www.play-in.com/pdf/rules_games/cosy_casa_regles.pdf;Esplanade-Centre 1;;182;non;oui;Observation,Pose de tuiles;Moderne & Réaliste;Moderne & Réaliste,Observation,Pose de tuiles;Vous venez d'emmener chez vous votre nouvelle étagère et il est maintenant temps d'y placer vos objets préférés : livres, jeux de société, portraits... Qui présentera la bibliothèque la mieux organisée ?;https://cdn2.philibertnet.com/566834-large_default/cosy-casa.jpg;https://www.gigamic.com/images/logo.png;https://www.youtube.com/watch?v=NWFui_U-Uqc
975;Sur le Fil;Julien Prothière, Juan Rodriguez;Gigamic;2 à 4 joueurs;7 ans;30 mn;Enfants;https://www.gigamic.com/files/catalog/products/rules/gigamic_surlefil_rules_compressed.pdf;Esplanade-Centre 1;;182;non;oui;Combinaison,Objectifs secrets;Oiseaux;Oiseaux,Combinaison,Objectifs secrets;Placez correctement les oiseaux sur le fil pour prendre le plus beau selfie possible ! Tout le monde aime se prendre en selfie… et les oiseaux ne font pas exception ! Les voici qui sautillent joyeusement de fil en fil avant d'immortaliser leurs poses au travers de photos souvenir délirantes. Aide-les à reproduire les figures demandées ;https://cdn2.philibertnet.com/566830-large_default/sur-le-fil.jpg;https://www.gigamic.com/images/logo.png;https://www.youtube.com/watch?v=NWvtcVxd2Lc
976;6 Qui Prend Junior;Wolfgang Kramer;Gigamic;2 à 5 joueurs;5 ans;20 mn;Tout public;https://regle.escaleajeux.fr/6nimj_rg.pdf;Esplanade-Centre 1;;182;non;oui;Cartes;Animaux de la Ferme;Animaux de la Ferme,Cartes;Les enfants conduisent les animaux dans les bâtiments de la ferme. Chaque fois qu'un joueur parvient à placer une 6ème espèce animale dans une ferme, il gagne toutes les cartes de la ferme en récompense. Qui sera le meilleur gardien de la ferme?;https://cdn3.trictrac.net/documents/formats/thumb_300_300/documents/originals/ce/7b/e6ca12525d708743ebae9a594aea14184bcb.jpeg;https://www.gigamic.com/images/logo.png;
979;[Kosmopoli:t] - Deuxième Service;Julien Prothière, Florent Toscano;Jeux Opla;4 à 8 joueurs;9 ans;30 mn;Ambiance;https://www.lad.education/pdf/regle-jeu/kosmopolit-regle-jeu-2020-jeux-opla.pdf;Esplanade-Centre 5;Esplanade-Centre 5b;220;oui;oui;Coopératif;Alimentation;Alimentation,Coopératif;Le restaurant le plus cosmopolite du monde est toujours (plus) ouvert avec désormais 100 langues et dialectes et 3 nouveaux menus : Petits chefs : Les enfants veulent cuisiner ? Une toque sur chaque tête ! / Grands chefs : Des plats plus élaborés ? Il faut désormais plusieurs Cuistots pour les préparer… / Boisson comprise : Quelle boisson pour quel plat ? Tous les rôles sont chahutés par un simple verre !;https://cdn2.philibertnet.com/556687-large_default/-kosmopoli-t-deuxieme-service.jpg;https://www.jeux-opla.fr/wp-content/uploads/cropped-logo_opla-1-1.png;https://www.jeux-opla.fr/produit/kosmopolit-deuxieme-service/
980;Apocalypse au zoo de Carson City;Alexandre Droit, Florent Toscano;Jeux Opla;2 à 4 joueurs;12 ans;30 mn;Tout public;https://cdn.1j1ju.com/medias/d7/1b/fb-apocalypse-au-zoo-de-carson-city-regle.pdf;Esplanade-Centre 5;Esplanade-Centre 5b;220;oui;oui;Cartes;Bandes Dessinées, Zombies;Bandes Dessinées, Zombies,Cartes;Entrez dans l'univers de la bande dessinée de Guillaume Griffon… Au cours de la partie, l'ambiance se tend et vos choix seront capitaux pour vous sortir de là. Vos personnages mutent en zombies, et les animaux de fortes valeurs disparaissent sous les attaques de vos adversaires.;https://cdn3.philibertnet.com/381516-large_default/apocalypse-au-zoo-de-carson-city.jpg;https://www.jeux-opla.fr/wp-content/uploads/cropped-logo_opla-1-1.png;https://www.youtube.com/watch?v=1AJYs7paTw8
981;Cartzzle - La Nuit Etoilée;Juan Rodriguez, Florent Toscano, David Boniffacy;Jeux Opla;1 à 2 joueurs;8 ans;30 mn;Tout public;https://www.youtube.com/watch?v=G8QTgPTmPpM;Esplanade-Centre 5;Esplanade-Centre 5b;220;oui;oui;Déduction,Observation;Arts;Arts,Déduction,Observation;Cartzzle est un nouveau concept de jeu de société contenant un jeu, une oeuvre d'art et des énigmes. Composez cette interprétation graphique de Pauline Détraz, puis refaites-la en relevant des défis.;https://cdn3.philibertnet.com/552145-large_default/cartzzle-la-nuit-etoilee.jpg;https://www.jeux-opla.fr/wp-content/uploads/cropped-logo_opla-1-1.png;https://www.youtube.com/watch?v=G8QTgPTmPpM
982;Cartzzle - Labyrinthe : Champs Dessus Dessous;Juan Rodriguez, Florent Toscano, David Boniffacy;Jeux Opla;1 à 2 joueurs;8 ans;30 mn;Tout public;https://www.youtube.com/watch?v=G8QTgPTmPpM;Esplanade-Centre 5;Esplanade-Centre 5b;220;oui;oui;Déduction,Observation;Art;Art,Déduction,Observation;Cartzzle est un nouveau concept de jeu de société contenant un jeu, une oeuvre d'art et des énigmes. Composez cette interprétation graphique de Pauline Détraz, puis refaites-la en relevant des défis.;https://cdn3.philibertnet.com/552147-large_default/cartzzle-labyrinthe-champs-dessus-dessous.jpg;https://www.jeux-opla.fr/wp-content/uploads/cropped-logo_opla-1-1.png;https://www.youtube.com/watch?v=G8QTgPTmPpM
983;Cartzzle - Foules;Juan Rodriguez, Florent Toscano, David Boniffacy;Jeux Opla;1 à 2 joueurs;8 ans;30 mn;Tout public;https://www.youtube.com/watch?v=G8QTgPTmPpM;Esplanade-Centre 5;Esplanade-Centre 5b;220;oui;oui;Déduction,Observation;Arts;Arts,Déduction,Observation;Cartzzle est un nouveau concept de jeu de société contenant un jeu, une oeuvre d'art et des énigmes. Composez cette interprétation graphique de Pauline Détraz, puis refaites-la en relevant des défis.;https://cdn1.philibertnet.com/552143-large_default/cartzzle-foules.jpg;https://www.jeux-opla.fr/wp-content/uploads/cropped-logo_opla-1-1.png;https://www.youtube.com/watch?v=G8QTgPTmPpM
984;Mille Fiori;Reiner Knizia;Schmidt Spiele;2 à 4 joueurs;10 ans;45 mn;Tout public;https://cdn.1j1ju.com/medias/85/4c/f3-mille-fiori-regle.pdf;Antigone-Sud 3;;193;non;oui;Commerce,Draft,Pose de tuiles;Verre;Verre,Commerce,Draft,Pose de tuiles;Dans Mille Fiori, vous jouez le rôle de fabricants et de négociants en verre qui veulent profiter au maximum de leur rôle dans la production de l'art du verre.;https://cdn1.philibertnet.com/531472-large_default/mille-fiori.jpg;https://www.schmidtspiele.de/files/layout/logo.png;https://www.youtube.com/watch?v=G8h4AC_jfaQ
985;Le Grand Prix de Belcastel;Wolfgang Warsch;Schmidt Spiele;2 à 4 joueurs;6 ans;30 mn;Tout public;https://cdn.1j1ju.com/medias/03/c3/2b-le-grand-prix-de-belcastel-regle.pdf;Antigone-Sud 3;;193;non;oui;Course;Moyen Age;Moyen Age,Course;Le Grand Prix de Belcastel est un jeu de course familial , où vous devrez faire avancer votre animal en le nourrissant et ainsi tenter de remporter la course du chaudron d'or !;https://cdn3.philibertnet.com/537606-large_default/le-grand-prix-de-belcastel.jpg;https://www.schmidtspiele.de/files/layout/logo.png;https://www.youtube.com/watch?v=dGXFdfV7r04
986;Funfair;Joel Finch;Lucky Duck Games;2 à 4 joueurs;10 ans;45 mn;Tout public;https://y8t6p8a4.map2.ssl.hwcdn.net/downloads/December2022/ebad357d03bda48a1baf763ff506d4ce.pdf;Antigone-Sud 1;Antigone-Sud 1a;201;oui;oui;Collection,Draft,Pouvoir;Loisirs;Loisirs,Collection,Draft,Pouvoir;Choissisez et construisez un mélange passionnant d’attractions dans votre propre parc à thème ! Améliorez vos attractions pour qu’elles correspondent aux plans ou simplement pour ériger des manèges imposants qui attirent les foules et rapportent le plus d’argent. Embauchez des membres du personnel et construisez de super attractions pour maximiser la stratégie de votre parc en vue de la victoire ! Avec une configuration et un gameplay rapides, Funfair est un jeu amusant et familial. Des objectifs faciles à complexes, de nombreuses cartes offrent de nombreux plans de jeu aux joueurs, qu’ils soient novices ou expérimentés.;https://cdn3.philibertnet.com/542598-large_default/funfair.jpg;https://y8t6p8a4.map2.ssl.hwcdn.net/img/luckyduck-logo.png;https://www.youtube.com/watch?v=JYO4SL8VNyo
987;Flamecraft;Manny Vega;Lucky Duck Games;1 à 5 joueurs;14 ans;90 mn;Tout public;https://cdn.1j1ju.com/medias/44/fe/3f-flamecraft-regle.pdf;Antigone-Sud 1;Antigone-Sud 1a;201;oui;oui;Commerce,Gestion de ressources,Pose d'ouvriers;Asie, Fantastique;Asie, Fantastique,Commerce,Gestion de ressources,Pose d'ouvriers;Dans Flamecraft, 1 à 5 joueurs jouent le rôle des gardiens de flammes, rassemblant des objets, plaçant des dragons et lançant des enchantements pour améliorer les boutiques de la ville.;https://cdn1.philibertnet.com/555165-large_default/flamecraft.jpg;https://y8t6p8a4.map2.ssl.hwcdn.net/img/luckyduck-logo.png;https://www.youtube.com/watch?v=gFmgGQtAWL0
988;Suburbia;Ted Alspach;Lucky Duck Games;1 à 4 joueurs;14 ans;90 mn;Tout public;https://y8t6p8a4.map2.ssl.hwcdn.net/downloads/October2022/b1a733197659b629a8a9e8f6f4018897.pdf;Antigone-Sud 1;Antigone-Sud 1a;201;oui;oui;Combinaison,Draft,Pose de tuiles;Construction de ville;Construction de ville,Combinaison,Draft,Pose de tuiles;Planifiez, construisez et développez votre petite ville en une grande métropole !  Utilisez des tuiles de construction hexagonales pour ajouter des zones résidentielles, commerciales, civiques et industrielles, ainsi que des points d’intérêt spéciaux qui offrent des avantages et tirent parti des ressources des villes voisines. Votre objectif est de faire prospérer votre arrondissement et de vous retrouver avec une population plus importante que n’importe lequel de vos adversaires.;https://cdn2.philibertnet.com/543568-large_default/suburbia.jpg;https://y8t6p8a4.map2.ssl.hwcdn.net/img/luckyduck-logo.png;https://www.youtube.com/watch?v=sBTI6r3zBmU
990;Le Roi des 12;Rita Modl;Lucky Duck Games;2 à 4 joueurs;10 ans;30 mn;Tout public;https://www.play-in.com/pdf/rules_games/le_roi_des_12_regles_fr.pdf;Antigone-Sud 1;Antigone-Sud 1a;201;oui;oui;Cartes,Dés;Moyen Age;Moyen Age,Cartes,Dés;Le Roi des 12 est un jeu de dés rapide et amusant dans lequel vous essayerez de vous emparer du trône. Affrontez les autres prétendants grâce à vos pierres à douze faces !;https://cdn1.philibertnet.com/498757-large_default/le-roi-des-12.jpg;https://y8t6p8a4.map2.ssl.hwcdn.net/img/luckyduck-logo.png;https://www.youtube.com/watch?v=JbUEU3ujFew
991;Earth;Maxime Tardif;Lucky Duck Games;1 à 5 joueurs;14 ans;90 mn;Experts;https://www.dropbox.com/s/jsern0ie8ycr980/Earth%20Rulebook_VF_LD.pdf?dl=0;Antigone-Sud 1;Antigone-Sud 1a;201;oui;oui;Gestion de main;Animaux, Ecologie, Nature;Animaux, Ecologie, Nature,Gestion de main;Earth est un jeu de construction de moteur dans lequel 1 à 5 joueurs ont pour objectif de créer des écosystèmes autosuffisants. Earth est un jeu aux règles simples, mais offrant de multiples possibilités stratégiques.;https://cdn3.philibertnet.com/564233-large_default/earth.jpg;https://y8t6p8a4.map2.ssl.hwcdn.net/img/luckyduck-logo.png;https://www.youtube.com/watch?v=t-KrI08-sEg
992;Bagarre !;Benjamin Roucayrol;Benjamin Roucayrol;3 à 6 joueurs;10 ans;30 mn;Ambiance;https://benjaminroucayrol.com/bagarre;Antigone-Sud 1;Antigone-Sud 1c;203;oui;oui;Cartes;Coopératives agricoles, paysans;Coopératives agricoles, paysans,Cartes;Vous êtes à la tête d’une des 3 coopératives agricoles qui nourrit notre bonne vieille France. Votre but ? Devenir le leader sur le marché et arriver à écouler vos produits en premier.;https://benjaminroucayrol.com/wp-content/uploads/2020/11/Software_Box_Mockup_1-600x420.png;https://benjaminroucayrol.com/wp-content/uploads/2023/01/cropped-cropped-baniere-hiver.png;https://www.youtube.com/watch?v=kW4j4b2iHAE&t=1s
993;Randognon;Benjamin Roucayrol;Benjamin Roucayrol;1 à 6 joueurs;8 ans;45 mn;Tout public;https://benjaminroucayrol.com/download/909/;Antigone-Sud 1;Antigone-Sud 1c;203;oui;oui;Cartes,Coopératif,Parcours;Randonnée;Randonnée,Cartes,Coopératif,Parcours;Comme son nom l’indique (pas trop), Randognon est un jeu de randonnée (pas trop) mignon ou le but est d'arriver vivant.;https://benjaminroucayrol.com/wp-content/uploads/2021/05/Randognon-boite-300x244.png;https://benjaminroucayrol.com/wp-content/uploads/2023/01/cropped-cropped-baniere-hiver.png;https://www.youtube.com/watch?v=RppC93AYHXI
994;Zoo-en-Boîte;;Smart Games;1 joueur;2 ans;15 mn;Enfants;https://www.smartgames.eu/fr/jeux-pour-1-joueur/zoo-en-bo%C3%AEte;Esplanade-Est 3;;181;non;oui;Casse-tête,Observation;Animaux du Zoo, Cubes;Animaux du Zoo, Cubes,Casse-tête,Observation;Jouons à cache-cache avec les animaux du zoo… Après avoir choisi un défi, il nous faudra empiler les cubes de telle manière que seuls les animaux demandés apparaissent face à nous. « Zoo en Boîte » est un jeu de manipulation et d’observation pour les petits qui intègre les notions de couleurs, de formes, de perspective, d'intérieur et d’extérieur. Fabriqué à partir de pièces en carton fort, ce jeu trouvera sa place dans toutes les chambres d’enfants.;https://cdn3.philibertnet.com/559691-large_default/zoo-en-boite.jpg;https://gamesbysmart.com/static/version1676365149/frontend/ToysBySmart/ToysBySmartTheme/fr_FR/images/toysbysmart-logo.svg;https://www.youtube.com/watch?v=wkAk8_k64U4
995;Safari Photo;;Smart Games;1 joueur;3 ans;;Enfants;https://www.smartgames.eu/fr/jeux-pour-1-joueur/safari-photo;Esplanade-Est 3;;181;non;oui;Casse-tête;Animaux;Animaux,Casse-tête;Trois, deux, un… on ne bouge plus ! Safari Photo est un jeu de logique dans lequel il faudra disposer trois animaux de façon à reproduire un cadre de photo donné ! Rappelez-vous que le lion n’aime pas l’eau, l’éléphant ne peut pas passer entre les rochers et les girafes sont trop grandes pour passer sous les arbres. Un jeu d’apprentissage deux en un pour les petits qui leur proposera soit de déplacer les animaux dans la savane selon leur imagination, soit de résoudre les défis proposés. « Safari Photo » est un jeu pour appréhender les formes, ainsi que les notions de dessus, dessous, derrière, devant, à droite, à gauche… Observez les formes des pieds de jeu et suivez le chemin !;https://d32bxxnq6qs937.cloudfront.net/sites/default/files/SG_SafariParkJr_PDPbanner-FR.jpg;https://gamesbysmart.com/static/version1676365149/frontend/ToysBySmart/ToysBySmartTheme/fr_FR/images/toysbysmart-logo.svg;
996;Chats Tournent en Rond;;Smart Games;1 joueur;7 ans;15 mn;Tout public;https://www.smartgames.eu/fr/jeux-pour-1-joueur/chats-tournent-en-rond;Esplanade-Est 3;;181;non;oui;Casse-tête;Chats;Chats,Casse-tête;Les chats adorent se cacher dans des boîtes en carton ! Déplacez les pièces de jeu l'une après l'autre jusqu'à ce que chaque chat soit dans un carton ! Arriverez-vous à trouver un coin douillet pour chacun des chats ? Un jeu de mouvement séquentiel pour petits et grands, dans un format pratique pour l'emporter partout.;https://d32bxxnq6qs937.cloudfront.net/sites/default/files/GBS_Cats%26Boxes_PDPbanner-FR_0.jpg;https://gamesbysmart.com/static/version1676365149/frontend/ToysBySmart/ToysBySmartTheme/fr_FR/images/toysbysmart-logo.svg;https://www.youtube.com/watch?v=5qnqNU-17qY
997;Parc'Ours en Forêt;;Smart Games;1 joueur;7 ans;25 mn;Tout public;https://www.smartgames.eu/fr/jeux-pour-1-joueur/parc%E2%80%99ours-en-for%C3%AAt;Esplanade-Est 3;;181;non;oui;Casse-tête;Nature, Animaux;Nature, Animaux,Casse-tête;Faites tourner les sapins, petits et grands, pour déplacer les figurines des personnages et des animaux afin de les aider à rejoindre leurs parents ou leur habitat. Cependant, faites attention, seul l'ourson pourra approcher maman ourse sans danger ! Découvrez une subtile mécanique d’engrenages pour résoudre les 80 défis évolutifs du livret, de facile à difficile.;https://d32bxxnq6qs937.cloudfront.net/sites/default/files/SmartGames_SG-531_Grizzly-Gears_product-packaging_6cc1d1.jpg;https://gamesbysmart.com/static/version1676365149/frontend/ToysBySmart/ToysBySmartTheme/fr_FR/images/toysbysmart-logo.svg;https://www.youtube.com/watch?v=j2TMTbC92Ws
998;La Cité d'Or;;Smart Games;1 joueur;8 ans;25 mn;Tout public;https://www.smartgames.eu/fr/jeux-pour-1-joueur/la-cit%C3%A9-d%E2%80%99or#:~:text=Disposez%20les%20quatre%20tuiles%20hexagonales,Cit%C3%A9%20d'Or%20est%20fig%C3%A9e.;Esplanade-Est 3;;181;non;oui;Casse-tête;Exploration;Exploration,Casse-tête;Explorez le vaste monde et partez à la recherche de la Cité d’Or cachée…;https://d32bxxnq6qs937.cloudfront.net/sites/default/files/SmartGames_SG-098_Treasure-Island_product-packaging_847a3e.jpg;https://gamesbysmart.com/static/version1676365149/frontend/ToysBySmart/ToysBySmartTheme/fr_FR/images/toysbysmart-logo.svg;
999;IQ Circuit;;Smart Games;1 joueur;8 ans;;Tout public;https://www.smartgames.eu/fr/jeux-pour-1-joueur/iq-circuit;Esplanade-Est 3;;181;non;oui;Casse-tête;Abstrait;Abstrait,Casse-tête;Le jeu IQ Circuit contient 120 défis à réaliser où vous devrez être astucieux et placer toutes les pièces du puzzle sur le plateau de jeu pour réaliser des circuits.;https://d32bxxnq6qs937.cloudfront.net/sites/default/files/SmartGames_IQ-467_IQ-Circuit_product-packaging_9567e9.jpg;https://gamesbysmart.com/static/version1676365149/frontend/ToysBySmart/ToysBySmartTheme/fr_FR/images/toysbysmart-logo.svg;https://www.youtube.com/watch?v=ZnIfmSXcvzg
1000;IQ Six Pro;;Smart Games;1 joueur;8 ans;;Tout public;https://www.smartgames.eu/fr/jeux-pour-1-joueur/iq-six-pro;Esplanade-Est 3;;181;non;oui;Casse-tête;Abstrait;Abstrait,Casse-tête;Q Six Pro est un jeu de voyage compact idéal. Mettez votre logique et votre réflexion à rude épreuve en relevant cent défis de différents niveaux de complexité.;https://d32bxxnq6qs937.cloudfront.net/sites/default/files/SmartGames_SG-479_IQ-Six-Pro_product-packaging_97f9cc%20%281%29_3.jpg;https://gamesbysmart.com/static/version1676365149/frontend/ToysBySmart/ToysBySmartTheme/fr_FR/images/toysbysmart-logo.svg;https://www.youtube.com/watch?v=GVBGdUzJ508
1001;IQ Love;;Smart Games;1 joueur;7 ans;;Tout public;https://www.smartgames.eu/fr/jeux-pour-1-joueur/iq-love;Esplanade-Est 3;;181;non;oui;Casse-tête;Abstrait;Abstrait,Casse-tête;IQ Love est un jeu de voyage compact idéal. Mettez votre logique et votre réflexion à rude épreuve en relevant cent défis de différents niveaux de complexité.;https://d32bxxnq6qs937.cloudfront.net/sites/default/files/SmartGames_SG-302_IQ-Love_product-packaging_2af93d_5.jpg;https://gamesbysmart.com/static/version1676365149/frontend/ToysBySmart/ToysBySmartTheme/fr_FR/images/toysbysmart-logo.svg;https://www.youtube.com/watch?v=ou34qs9isr4
1002;IQ Stixx;;Smart Games;1 joueur;7 ans;;Tout public;https://www.smartgames.eu/fr/jeux-pour-1-joueur/iq-stixx;Esplanade-Est 3;;181;non;oui;Casse-tête;Abstrait;Abstrait,Casse-tête;IQ Stixx est un jeu de casse-têtes solo, proposant 120 défis à difficulté croissante.Empilez les bâtonnets colorés pour obtenir la bonne combinaison.;https://cdn2.philibertnet.com/545989-large_default/iq-stixx.jpg;https://gamesbysmart.com/static/version1676365149/frontend/ToysBySmart/ToysBySmartTheme/fr_FR/images/toysbysmart-logo.svg;https://www.youtube.com/watch?v=9nJuHa6mKI4
